{
  "intake_id": "0455d047-5aae-4aa0-8ecd-83494c4394ec",
  "timestamp_utc": "2026-02-22T23:36:46Z",
  "decision": {
    "recommended_pipeline": "chainsaw_evtx",
    "evidence_path": "/home/nevermore/cases/intake/evtx/Logs",
    "status": "dispatch"
  },
  "result": {
    "ok": true,
    "run_id": "f5ab3732-4540-4dc2-825a-fecc50075c51",
    "manifest_path": "outputs/jsonl/chainsaw_evtx/f5ab3732-4540-4dc2-825a-fecc50075c51/manifest.json"
  }
}