{
  "intake_id": "090d3c78-a33f-429a-bd6c-becd7afef304",
  "timestamp_utc": "2026-02-11T23:37:21Z",
  "decision": {
    "recommended_pipeline": "chainsaw_evtx",
    "evidence_path": "/home/nevermore/cases/intake/evtx/Logs",
    "status": "dispatch"
  },
  "result": {
    "ok": true,
    "run_id": "4e962c85-f25a-49e6-8c74-cd7d9872f104",
    "manifest_path": "outputs/jsonl/chainsaw_evtx/4e962c85-f25a-49e6-8c74-cd7d9872f104/manifest.json"
  }
}